{
  "version": 2,
  "schema_version": 2,
  "source": "Woccon reconstruction correspondence registry (Phase 2)",
  "generated_at": "2026-08-02T05:17:05+00:00",
  "generator": "merge_segment_rules",
  "rules": [
    {
      "id": "grammar_06df8001",
      "rule_kind": "sister_wc",
      "lhs": null,
      "rhs": null,
      "environment": "default",
      "direction": "w_to_c",
      "correspondence_status": "singleton",
      "example_cognate_ids": [],
      "grammar_lineage": "siouan_comparative",
      "source": "rules_unified.json community_grammar_notes",
      "notes": null,
      "provenance_text": "Woccon numeral formation shows evidence of morphological complexity in higher numerals. The attested form 'Soone nomme' (twelve) appears to contain a root for 'three' rather than 'two', suggesting a non-decimal counting pattern or compound formation strategy. This contrasts with the simpler forms 'nlp' (two) and 'noponne' (ten), where 'noponne' shows no clear relationship to 'nlp' but contains a cognate element with Catawba [nopq] 'one'. The morphological structure of Woccon numerals indicates complex formation rules that may involve root substitution or compound patterns not immediately transparent from the surface forms. Workers should note that Woccon numeral morphology may not follow expected decimal patterns and should analyze each numeral form independently for its constituent morphemes."
    },
    {
      "id": "grammar_140c7ead",
      "rule_kind": "sister_wc",
      "lhs": null,
      "rhs": null,
      "environment": "default",
      "direction": "w_to_c",
      "correspondence_status": "singleton",
      "example_cognate_ids": [],
      "grammar_lineage": "siouan_comparative",
      "source": "rules_unified.json community_grammar_notes",
      "notes": null,
      "provenance_text": "Woccon numeral formation: The numeral 'eight' in Woccon is formed from the root for 'two'. Attested form: Nupsau 'eight'. This demonstrates a derivational pattern where higher numerals can be morphologically related to lower numerals. The exact morphological process is not detailed in the source, but the relationship to the 'two' root is established through comparison with Catawba ddwasa 'eight' which also derives from the root for 'two'. This suggests Woccon may have inherited or developed similar numeral derivation patterns as found in related Catawban languages."
    },
    {
      "id": "grammar_19cc5e86",
      "rule_kind": "sister_wc",
      "lhs": null,
      "rhs": null,
      "environment": "default",
      "direction": "w_to_c",
      "correspondence_status": "singleton",
      "example_cognate_ids": [],
      "grammar_lineage": "proto_catawban",
      "source": "rules_unified.json community_grammar_notes",
      "notes": null,
      "provenance_text": "It seems that dápa may have meant (wild) animal in Proto-Catawban, a meaning retained in Woccon but only in compounds in Catawba"
    },
    {
      "id": "grammar_1eea4fe3",
      "rule_kind": "sister_wc",
      "lhs": null,
      "rhs": null,
      "environment": "default",
      "direction": "w_to_c",
      "correspondence_status": "singleton",
      "example_cognate_ids": [],
      "grammar_lineage": "siouan_comparative",
      "source": "rules_unified.json community_grammar_notes",
      "notes": null,
      "provenance_text": "Woccon shows a systematic correspondence with initial [wa-] patterns that align with broader Macro-Siouan relationships. In lexical sets comparing Woccon with related languages, Woccon preserves [wa-] initial sequences that correspond to Catawba [wa-] and contrast with Proto-North-Caddoan [hu-]. Attested examples include: 'Wawawa' (snow) where Catawba has 'wa?, wa?wa', and 'Wattapi untakeer' (star) where Catawba has 'wapitnu'. This [wa-] preservation in Woccon represents retention of an older pattern, as evidenced by the fact that the [wa-] form is also preserved in Caddo while Proto-North-Caddoan [hu-] represents an innovation. This correspondence pattern can be used to identify potential cognates and analyze the historical development of Woccon phonology."
    },
    {
      "id": "grammar_2a644187",
      "rule_kind": "diachronic_ps",
      "lhs": null,
      "rhs": null,
      "environment": "ps_retention",
      "direction": "ps_to_w",
      "correspondence_status": "tentative",
      "example_cognate_ids": [],
      "grammar_lineage": "proto_siouan",
      "source": "rules_unified.json community_grammar_notes",
      "notes": null,
      "provenance_text": "Woccon preserves Proto-Siouan initial *w- in certain lexical items where other Siouan languages have lost or modified this consonant. The attested Woccon form 'Watt' (boat, canoe) retains the initial w- from Proto-Siouan *wati, while Ofo and Biloxi lost initial [w] at a relatively early stage, with Ofo showing epenthetic [y] (iyati) and Biloxi showing epenthetic [h] (nahati). This pattern suggests that when analyzing or reconstructing Woccon forms, initial w- may be preserved in contexts where related languages show vowel-initial forms or epenthetic consonants. Compare: Woccon 'Watt' vs Ofo 'iyati', Biloxi 'nahati' from Proto-Siouan *wati."
    },
    {
      "id": "grammar_2f8a5176",
      "rule_kind": "diachronic_ps",
      "lhs": null,
      "rhs": null,
      "environment": "ps_retention",
      "direction": "ps_to_w",
      "correspondence_status": "tentative",
      "example_cognate_ids": [],
      "grammar_lineage": "proto_siouan",
      "source": "rules_unified.json community_grammar_notes",
      "notes": null,
      "provenance_text": "Woccon shows a specific pattern of consonant cluster simplification in the word for 'three' that differs from other Siouan languages. The Proto-Siouan root for 'three' contained a medial [*mn] cluster, as evidenced by forms like Catawba [namone], Lakhota [yamni], and Omaha [dabdi]. Woccon simplified this cluster by losing the second element (the [n]), resulting in Nam-mee, phonetically [nami]. This contrasts with Tutelo, Ofo, Biloxi, and the Chiwere dialects, which lost the first element instead, giving Tutelo [nani]. Woccon's pattern of losing the second element aligns it with Hidatsa and Crow rather than with the Virginia Siouan languages. This phonological process demonstrates that Woccon belongs to the Carolina Siouan group and shows closer affinity to Catawba than to Tutelo or other eastern Siouan languages."
    },
    {
      "id": "grammar_36b6df6c",
      "rule_kind": "sister_wc",
      "lhs": null,
      "rhs": null,
      "environment": "default",
      "direction": "w_to_c",
      "correspondence_status": "singleton",
      "example_cognate_ids": [],
      "grammar_lineage": "siouan_comparative",
      "source": "rules_unified.json community_grammar_notes",
      "notes": null,
      "provenance_text": "Woccon exhibits phonological simplification of consonant clusters, specifically the reduction of [mn] clusters to [m]. This represents a systematic sound change that distinguishes Woccon from related Catawban languages. The simplification pattern shows Woccon's independent phonological development within the Siouan family. This rule would apply to any inherited or borrowed forms containing [mn] sequences, reducing them to simple [m] in Woccon pronunciation and potentially affecting morphophonological alternations in word formation."
    },
    {
      "id": "grammar_37c69fe1",
      "rule_kind": "sister_wc",
      "lhs": null,
      "rhs": null,
      "environment": "default",
      "direction": "w_to_c",
      "correspondence_status": "singleton",
      "example_cognate_ids": [],
      "grammar_lineage": "siouan_comparative",
      "source": "rules_unified.json community_grammar_notes",
      "notes": null,
      "provenance_text": "Woccon appears to have had essentially the same inventory of consonantal phonemes as Catawba."
    },
    {
      "id": "grammar_39bac528",
      "rule_kind": "diachronic_ps",
      "lhs": null,
      "rhs": null,
      "environment": "ps_retention",
      "direction": "ps_to_w",
      "correspondence_status": "tentative",
      "example_cognate_ids": [],
      "grammar_lineage": "siouan_comparative",
      "source": "rules_unified.json community_grammar_notes",
      "notes": null,
      "provenance_text": "Woccon preserves Proto-Macro-Siouan *[y] as [y]. This sound correspondence is attested in multiple Woccon lexical items and represents a conservative retention from the proto-language. Examples from Woccon include: 'Yonne' (tree), 'Yau' (fire), 'Yah-testea' (ashes, black/blue), 'Yau-huk' (snake), 'Yacunne' (fish), 'ya-' (water), and 'Yauh' (road). This pattern shows Woccon maintains the original *[y] sound where related languages like Lakhota show [ch]. The preservation of this sound in word-initial position appears to be systematic in Woccon, making it a reliable phonological feature for identifying cognate relationships and reconstructing proto-forms."
    },
    {
      "id": "grammar_39bfcc27",
      "rule_kind": "diachronic_ps",
      "lhs": null,
      "rhs": null,
      "environment": "ps_retention",
      "direction": "ps_to_w",
      "correspondence_status": "tentative",
      "example_cognate_ids": [],
      "grammar_lineage": "proto_siouan",
      "source": "rules_unified.json community_grammar_notes",
      "notes": null,